{
  "protocol_version": "1.0",
  "project": "NEXTechTW/Vitality",
  "generated_at": "2026-09-06T13:33:39.315Z",
  "score": 52,
  "maintenance": {
    "score": 50,
    "issue_response": 0,
    "pull_request_response": 0,
    "backlog_trend": "+0% (90d)",
    "breakdown": [
      {
        "label": "Issue first-response speed",
        "delta": 25
      },
      {
        "label": "PR first-review speed",
        "delta": 25
      },
      {
        "label": "PR merge rate",
        "delta": 0
      },
      {
        "label": "Issue resolution rate",
        "delta": 0
      },
      {
        "label": "Release recency",
        "delta": 0
      }
    ]
  },
  "community": {
    "score": 15,
    "active_contributors": 1,
    "contributor_growth": 0,
    "contributor_diversity_index": 0,
    "breakdown": [
      {
        "label": "Active contributors in window",
        "delta": 4
      },
      {
        "label": "Contributor diversity index",
        "delta": 0
      },
      {
        "label": "Contributor count growth",
        "delta": 6
      },
      {
        "label": "New contributors this window",
        "delta": 5
      }
    ]
  },
  "security": {
    "score": 100,
    "known_vulnerabilities": 0,
    "dependency_risk": "none",
    "breakdown": [
      {
        "label": "No known vulnerabilities",
        "delta": 0
      }
    ]
  },
  "releases": {
    "score": 40,
    "frequency": "frequent",
    "stability": "high",
    "breaking_change_rate": "none",
    "breakdown": [
      {
        "label": "No releases in analysis window",
        "delta": 0
      },
      {
        "label": "Release cadence",
        "delta": 0
      },
      {
        "label": "Release cadence stability",
        "delta": 15
      },
      {
        "label": "Breaking change rate (major version bumps)",
        "delta": 15
      },
      {
        "label": "Early-stage project (no cadence history yet)",
        "delta": 10
      }
    ]
  },
  "provenance": {
    "data_sources": [
      "github_api",
      "osv_database"
    ],
    "computation_hash": "sha256:f158ddaa0c2d42d280f99018025b0146641217c5930baf4a93bc0288e702ae09",
    "reproducible": true,
    "algorithm_version": "1.0.0"
  }
}